Unnamed: 0	text	screen_name	location	LAT	LON
833	in a one on one conversation you should always start by give the other person the benefit of the doubt prolife	EqualRightsInst	Charlotte, NC	35.2270869	-80.8431267
834	join we on Zoom Meeting tonight at pm est as we pray for Dobbs here be the info to be involve Join Zoom Meeting Meeting ID Passcode prolife pray	revmahoney	Washington, DC	38.9071923	-77.0368707
835	many abortion business be plan to shut down indefinitely as the law go into effect as many abortionist be unwilling to continue end the life of the preborn when they could face civil lawsuit ProLife HeartbeatAct text PROLIFE to	TXRightToLife	God's country	47.3074111	-93.5571212
836	for you create my inmost be you knit I together in my mother womb I praise you because I be fearfully and wonderfully make your work be wonderful I know that full well Psalm NIV fearfullyandwonderfullymade Bible Psalms ProLife abortionismurder	screen_flick	United States	37.09024	-95.712891
838	when Governor Pritzker sign the Reproductive Health Act into law he put the life of woman and preborn baby throughout the Midwest in jeopardy read more at the Federalist prolife prolifegen lovelife investigation safety caution	ILRight2Life	Illinois 	40.6331249	-89.3985283
839	if you do like it when pro choice people dehumanize the unborn then you have no business dehumanize pro choice people prolife	EqualRightsInst	Charlotte, NC	35.2270869	-80.8431267
840	the question have to be ask why would Nancy Pelosi and other Democrats work so hard to block a vote on stop infanticide this should be a vote without hesitation ProLife	indianafamily	Carmel, IN	39.978371	-86.1180435
841	this be a true denial of justice for Joseph Boever amp his family hypocritical of any in who claim to be ProLife to think fine be acceptable punishment for take a he need to go SoDak AG get fine no jail time in pedestrian death	KitOlson27	Edina, MN	44.8896866	-93.3499489
842	ICYMI Father Denis Wilde give a great interview on the Feast of Bartholomew yesterday ThursdayMotivation ProLife	JanetMorana	International	37.09024	-95.712891
843	speak truth ProLife	mod_trad	South East, England	52.3555177	-1.1743197
844	what about the medically fragile child who need regular hospital visit who ca be see because the hospital be full of preventable covid case wear mask get vaccinated prevent these hospital surge and the kid who need regular care be more prolife pls	jenkilks	Las Vegas, NV	36.1699412	-115.1398296
845	there be child too young to be vaccinate who have health condition make they high risk for COVID what happen to they bc you ca wear a mask or get vaccinate why ca you put that save the child energy toward protect they ProLife COVID protectthekid	jenkilks	Las Vegas, NV	36.1699412	-115.1398296
846	there be kid with RSV who ca go into hospital in some place because they be overwhelmed with COVID case wear mask prevent this get vaccinated prevent this do you care ProLife	jenkilks	Las Vegas, NV	36.1699412	-115.1398296
847	meet our Secretary Macie she a sophomore Comms Major here at Tarleton she have be involve with the pro life movement since last November thank for all you do Macie prolife prolifegeneration	TarletonS4L	Stephenville, TX	32.2206958	-98.2022633
848	I think Republicans be ProLife guess that be only mean sometimes	MiSFiT93_	Wouldn't you like to know.	44.9811287	-93.16762829999999
850	for people who claim to be ProLife you sure do get a hard on over people die	idnac4u	Irving, TX	32.8140177	-96.9488945
851	great morning at the amp Ham Breakfast enjoyed visit with dear friend and former colleague thank you and all for stop by our and for your endorsement and support of ProLife	addiawuchner	Florence, KY	38.9989499	-84.62661109999999
852	I wish I have time to do this but someone should on a daily basis email the number for child under hospitalize and infect to utleg and everyone on SL Co council who vote to ban mask include prolife	NerdmomApril	Salt Lake City, UT	40.7607793	-111.8910474
853	Ron DeSantis criticize Biden for not end the pandemic he make bad tcot prolife DesantisVariant	TerrellDLewis	Loves Park, IL	42.3200189	-89.05816209999999
854	as Florida face record death DeSantis say Biden should kill people too tcot prolife	TerrellDLewis	Loves Park, IL	42.3200189	-89.05816209999999
855	do I think therefore I be prove that a fetus be a person prolife	EqualRightsInst	Charlotte, NC	35.2270869	-80.8431267
856	the National Catholic Bioethics Centre have come out strongly against mandatory covid vaccine our provincial and federal government must stop force amp coerce Canadians to take the abortion taint injection cdnpoli prolife	JackFonsec	Ontario, Canada	51.253775	-85.323214
857	ICYMI I be on host by and sponsor by Lutheran Public Radio I discuss my recent article where admit they be lose the online message battle with pro lifer Enjoy ProLife	Michael_J_New	Washington, DC	38.9071923	-77.0368707
858	era supporter hold August rally at Supreme Court NRLC SCCL SCLIFE ProLife	LIFEforSC	South Carolina	33.836081	-81.1637245
859	be not ProLife that be it that be the whole damn tweet	JamiRheaB	Las Vegas, NV	36.1699412	-115.1398296
860	do Fauci his Florida if you be really ProLife you do not vote for a republican ever anywhere	eve_putman	New England	43.9653889	-70.8226541
861	there be no justification for kill baby EndAbortion ProLife	createdequalorg	Columbus, OH	39.9611755	-82.99879419999999
862	ENOUGH be ENOUGH JoeBiden treason Afghanistan Taliban Biden KamalaHarris WePickNick republican Congress takebackthehouse patriot conservative ProLife ReligiousLiberty FreeSpeech SecureBorders Constitution billofright freedom	WePickNick	R-NJ-5	41.0958261	-74.7337069
863	CatholicTwitter look for a ProLife baby shower gift look no far	theLyonbrary	Hatboro, PA	40.1742757	-75.10683879999999
864	why bodily right argument for abortion logically necessitate extremism prolife	EqualRightsInst	Charlotte, NC	35.2270869	-80.8431267
866	the millennial generation be significantly pro life and as in every year very present at the March for Life lifefromconceptionnoexception numberoneissue ProLife Whywemarch UK London	March4LifeUK	London, England	51.5073509	-0.1277583
867	must watch most unexpected caped man appear at Town Board meeting as a passionate ProLife champion ROC	MikeSaffran	Rochester, N.Y.	43.15657789999999	-77.6088465
868	abortion activist just file three MORE lawsuit AGAINST TEXAS right to LIFE Wednesday we wo back down put on the full armor of God now be the time join our list text prolife to ProLife praytoendabortion	TXRightToLife	God's country	47.3074111	-93.5571212
869	you ca claim you prolife when you also ban maskmandate you kill America child amp you know it all for political theater Shame	fishpolitically	Maine, USA	45.253783	-69.4454689
870	happy Women Equality Day from the staff at Illinois Right to Life we look forward to the day when every even those in the be treat equally and when a woman unique ability to carry child be value and respect universally woman female prolife love	ILRight2Life	Illinois 	40.6331249	-89.3985283
871	Chairwoman mom military wife family physician amp former AZ State Senator fightfortrump keepamericagreat ProLife ProFamily ProFreedom	TammyBaldwinner	 Manifesting Senator Barnes 	41.8821196	-87.6361181
872	american prolifer applaud our french prolife colleague	DrJeffKoloze	Garfield Heights, Ohio, USA	41.4169974	-81.6059581
874	great group of people be about connect with people and build relationship goodpeople prolife humandignity respect pray faith catholic christian Jesus lovethemboth	mike_rippy	Notre Dame, IN	41.7001908	-86.23793280000001
875	how very not ProLife of you to not care one bit about the health safety of God child to put your twisted idea of principle ahead of save the life of the human being he create WWJD not that sis	CapitalismRox	Upstairs from Luke's Diner, Stars Hollow, CT	41.6032207	-73.087749
876	if you be at SeeLife this weekend we hope you will stop by the NIFLA table and say hello ProLife	NIFLA	Fredericksburg, Virginia	38.3031837	-77.4605399
877	so your definition of be prolife be that you do not care that you be spread a deadly disease to other who do not share your death wish that be just super twisted WWJD actually live that prolife rhetoric you spout at every turn GetVaccinated wearamask	CapitalismRox	Upstairs from Luke's Diner, Stars Hollow, CT	41.6032207	-73.087749
878	so you advocate that we kill hundred of thousand of human fetus ProLife	RenoCow	Carson City, NV	39.1637984	-119.7674034
879	America in Crisis one way to let your voice be Heard politician need to know people be watch and will hold they accountable to do their duty please sign the petition ProLife NationalSecurity humantrafficke via	operationrescue	Wichita, KS, USA	37.68717609999999	-97.33005299999999
881	today reading for gratitude and constant vigilance in faith pray DailyMass catholic christian Prolife DailyMass ThursdayMotivation ThursdayThoughts faith	DailyMass	USA	37.09024	-95.712891
882	tshirt design idea for thought prolife righttolife goirish tour lovethemboth davinci preborn illustraction art embryo baby science prolifegen mother child	mike_rippy	Notre Dame, IN	41.7001908	-86.23793280000001
883	another great article from focus on how to address the accusation that privilege white woman ca say anything about abortion which be need for those less privileged via prolife	StupidRock	Ohio, USA	40.4172871	-82.90712300000001
884	the bad be yet to come re transmission in school as a man of the christian faith you claim to be prolife however your action show otherwise allow continuous learning through state of emergency executive order your voter be die	mklinebarnes	Tennessee	35.5174913	-86.5804473
885	this man be try to kill we all so much for he be ProLife	tinacannonTX	Austin, TX	30.267153	-97.7430608
886	ProLife Anthon response be to mimic Ricketts personal choice I check the Gov have say NE be a pro LoopyLogic if NE be pro life why be it allow anti vaxxer amp anti masker to act as abortionist when it come to the already bear child in school	Rothoula	Midwest	38.5010876	-90.333123
888	pro lifer only care about what happen before birth once they be bear and be real people they do give a rat ass prolife wearingmask SchoolChoice schoolshooting	T_Chaze	Michigan	44.3148443	-85.60236429999999
889	gun in school fight against MaskMandates the GOP have a death wish against our child so much for ProLife	MuckleBow	Los Angeles, CA	34.0522342	-118.2436849
890	anti life priest deliver vaccine lie to worshiper I would touch it with a foot pole tcot prolife GOPProDeath DiSantisVariant molochworship evangelicalsprodeath Christian Catholic	TerrellDLewis	Loves Park, IL	42.3200189	-89.05816209999999
891	Democrats and independent have no choice but to vote prolife in and beyond which mean vote Republican	DrJeffKoloze	Garfield Heights, Ohio, USA	41.4169974	-81.6059581
893	honest dialogue be aim at truth which make it the great friend of the truth seeker prolife	EqualRightsInst	Charlotte, NC	35.2270869	-80.8431267
894	PlannedParenthood Fauci NIH prochoice ProLife abortionishealthcare do anyone really believe the same People who support Gruesome Research with Aborted Baby Parts care about strand Americans in Afghanistan via	katerina5k	Brooklyn, NY	40.6781784	-73.9441579
896	excite to be do a television program with Fr Pavone discuss our prayer gathering at the Supreme Court for Dobbs on October praytoendabortion ProLife pray	revmahoney	Washington, DC	38.9071923	-77.0368707
897	its bad bad bad who execute an unborn little baby boy or girl out of pure convenience be about as evil amp vile as a human can possibly get the day will come one day when we have sensible justice on SCOTUS amp they will throw out Roe Wade its long overdue ProLife	memphis_pat	Memphis, TN	35.1495343	-90.0489801
899	up next why Drew Hancock change his mind amp become ProLife	QuestFanning	ProspectLeffertsGardens, Bklyn	40.6592355	-73.9533895
900	pro life supporter host March for Life in California SWNews US californian ProLife CaliforniaMarchforLife MarchforLife CaliforniaFamilyCouncil walkforlifewestcoast onelifela JeanneMancini JonathanKeller CaliforniaFamilyCouncil JamesGallagher SenatorShannonGrove	shalomworldnews	Edinburg, Texas	26.3017374	-98.1633432
901	because every life deserve love lifefromconceptionnoexception numberoneissue ProLife Whywemarch UK London	March4LifeUK	London, England	51.5073509	-0.1277583
902	if you be ProLife in Pittsburgh please consider attend the fall fundraiser for the Women Choice Network I be sponsor a table there on behalf of the pro life Libertarian Caucus there be no cost to attend but they do ask you to register	Samrobb4Liberty	Pittsburgh, PA	40.44062479999999	-79.9958864
904	here be one for all under educate murican bless with tiny head ProLife jesus fairytale	dropcsharp	SVIDEN	39.626667	117.10589
905	on Morning Show Lawmakers go after CRT friend or family blunderin Biden become prolife Larry Elder could WIN in CA Nolan on the LP MORE txt	QuestFanning	ProspectLeffertsGardens, Bklyn	40.6592355	-73.9533895
906	today reading for gratitude and constant vigilance in faith pray DailyMass catholic christian CatholicTwitter Prolife DailyMass ThursdayMotivation ThursdayThoughts faith	DailyMass	USA	37.09024	-95.712891
907	why do someone who claim to be prolife keep block school mask mandate sound like you pro birth and after that you do give a	fishpolitically	Maine, USA	45.253783	-69.4454689
908	if you ProLife and be against abortion what stop you from get vaccinate help I understand	JaymanShameel	Sri Lanka	7.873053999999999	80.77179699999999
909	the chinese government expansion of its population control policy to permit three child per family should not be a reason for rejoicing ProLife advocate say	NewYorkFamilies	Rochester, NY	43.15657789999999	-77.6088465
910	want maskless kid in school while Florida break Covid record how be that prolife	fishpolitically	Maine, USA	45.253783	-69.4454689
911	good morning please get involve send information to your parish priest make an announcement at your church it be all ready to go click to download lifefromconceptionnoexception numberoneissue ProLife Whywemarch UK London	March4LifeUK	London, England	51.5073509	-0.1277583
912	so some looney toon in Texas be try to get patient and doctor arrest with this prolife whistleblower site would be a shame if everyone spamme it with fake report ProLife abortionishealthcare	MikeyIsWriting	Washington, DC	38.9071923	-77.0368707
913	I be ProChoice when it come to force people to take medicine they do want I be ProLife when it come to make infanticide illegal there be nothing hypocritical about that	no_its_iowa	Iowa, USA	41.8780025	-93.097702
914	Friedrich Naumann Foundation Scholarships for Master and phd humanright equality love covid freedom humanity blacklivesmatter justice coronavirus prolife education peace unitednation activism democracy civilright equalright	plopandrew	Canada	56.130366	-106.346771
915	stop your Vaccines for be prolife concern for all life be not just for the unborn	Unfit4President	United States	37.09024	-95.712891
916	ProLife people well get on board with this now	maxinevaccine2	 🍁	38.7782428	-95.1781982
917	turn your fitness into your Witness wear Action Cross apparel by and receive off at Checkout SoulTrotters actioncross baselinebrad SoulCoolFit trustingstepbystep fitnessintowitness Israel ProLife Jesus	BaselineBrad21	San Diego, CA	32.715738	-117.1610838
918	thirty three day of wear my ProLife remembertheunborn life Runners gear honor all human life from conception to natural death of a limited number of daily run August two mile clear	JustinMcClainOP	In a book in Maryland, USA	39.325211	-76.610146
919	NEW video vote for a Political Party mean you knowingly or unknowingly support everything they believe trumpwasright ProLife politic vaccine Afganistan afghanistanburne afghan BorderCrisis JoeBiden	TheVirgoPoet	SoCal.. Los Angeles,CA 	34.050075	-118.2531767
920	because once you be actually bear conservative believe you be on your own unless you be a zygote or embryo that can be exploit for political expediency they do give a damn about you ProLife my ass getvaccinatedsavelive	BamaJayHayes	Alabama, USA	32.3182314	-86.902298
922	I do want to hear from about be ProLife	mhp_1776	Texas, USA	31.9685988	-99.9018131
923	be a child killer know full well child under ca be vaccinate he threaten school who follow the datum and require Mask ProLife my Ass	CamilleJivajen	Atlantic Beach Florida	30.3344077	-81.398696
924	pray to end abortion ProLife	FountainMj	Sarasota, FL	27.3364347	-82.53065269999999
925	I follow you because you ProLife can you please quit be so focused on your weird antivax campaign it work against your prolife platform	BigClyde5	Arizona	34.0489281	-111.0937311
926	do you dare say alllivesmatter or ProLife if you refuse to get vaccinate or wear a mask because COVID only kill those with pre exist condition I say what I say	ebbie_patterson	405	35.4776001	-97.518554
928	Hail Mary full of Grace the LORD be with thee bless art thou among woman and bless be the fruit of thy womb JESUS Holy Mary Mother of GOD pray for we sinner now and at the hour of our death amen Peace Love ProLife PrayTheRosay	guatemayabyesi	Virginia, USA	37.4315734	-78.6568942
929	GregAbbott be not ProLife his political eo be kill child CDC child in Texas have be hospitalize with AAofPediatrics child be admit to Texas hospital with between July and	emolumentalass	💜Texas💙	32.9857619	-96.7500993
930	republican governor be like sacrifice your GRANDMA sacrifice your year old son ProLife GOP	steve_taurus	Atlanta, GA	33.7489954	-84.3879824
931	never never never want to hear the RepublicanParty refer to as ProLife these governor be literally harm and yes killing child with their anti science garbage	inclusionchick	Davis, CA	38.5449065	-121.7405167
932	now the selfish odd be good I be fine people and the I scared people be kill the senior veteran disable child not ProLife FDA have approve Pfizer no more flimsy excuse	notsolittleold1	California, USA	36.778261	-119.4179324
933	joining tonight on ProLife praise be her son Derrick King tune in at ET at WednesdayMotivation wednesdaythought	JanetMorana	International	37.09024	-95.712891
934	and he suppose to be ProLife	truefauxfilms	SoCal🏝	34.9592083	-116.419389
935	a small act of kindness may be just the thing that help someone face the challenge before they prolife	BradMattes	Cincinnati, OH	39.1031182	-84.5120196
936	DesantisDestroysFlorida gopdeathcult GOP be prolife nor MAGA as kill their child GOP amp MAGA be not Patriots they weaklings amp killer of their own child bc they afraid of a shot ChildAbuse they only defend an embryo Florida VoteThemOut	harkim3	United States	37.09024	-95.712891
938	discussion of abortion be often cast aside as political or religious topic but the reality be that the very heart of the discussion be base solely in science all lead embryology textbook confirm this many abortionist even agree with that too prolife proscience	HumanDefenseINI	hello@humandefense.com	41.89263200000001	-88.47276800000002
939	DesantisDestroysFlorida Florida he allow your child to go to school w the KILLER antivaxxer should be charge with child abuse Republicans MAGA amp FakeChristians like of amp be not ProLife they the gopdeathcult	harkim3	United States	37.09024	-95.712891
940	pro life Texans be celebrate a court decision prohibit the dismemberment of live baby in the womb abortionist have fight hard for the past four year to block the Lone Star State from enact a ban pass in ProLife	TXRightToLife	God's country	47.3074111	-93.5571212
941	every story in the prolife movement matter	savethestorks	Colorado Springs, CO	38.8338816	-104.8213634
942	little conversational agreement give conversation structure and order prolife	EqualRightsInst	Charlotte, NC	35.2270869	-80.8431267
944	Bizarro Republicans out here chase death and we actual ProLife folk be fight everyday just to get through the try not to die Challenge Midterms BlueTsunami TheRedneckoning gopdeathcult PhilValentine yeetthegop	truthaddict76	Dumbass, TN	35.5174913	-86.5804473
945	this should be interesting go forward I hope both side can co exist relatively peacefully like they do a block from my Wilmington office one morning a week ProLife prochoice	BarrishCris	Newark, Delaware	39.6837226	-75.74965720000002
947	reason why this be the most effective response I have ever see to the you a man argument prolife	EqualRightsInst	Charlotte, NC	35.2270869	-80.8431267
948	we love child not so much prolife	RunawayDaines	Belgrade, MT	45.7762463	-111.1770945
949	many woman be die while pregnant and their very much want baby be die in utero prolife or prochoice this should unite we all VaccinesInPregnancy	AureliaCotta	Toronto, Ontario	43.653226	-79.3831843
950	so the governor of the less government oversight party be pass rule on a something not prolife governor nothing but distraction amp hypocrisy let do well with the upcoming election Texas	txindn	Texas	31.9685988	-99.9018131
952	US Senate Votes to preserve Hyde Amendment the Senate vote to preserve the prolife Hyde and Weldon Amendments during discussion of a trillion human infrastructure bill that lay out a blueprint for spending SaveHyde	ProLifeSTL	St. Louis, MO	38.6270025	-90.19940419999999
953	this be a short beautiful video of the journey of life within the womb watch it it be worth sharing prolife prolifeprowoman	ChildnotChoice	Des Moines, Iowa  USA	41.5868353	-93.6249593
954	what the hell man ProLife my ass	amphetamine47	Carmel, IN	39.978371	-86.1180435
955	the ProLife Party Republicans	mlynch5396	East Tennessee	35.5174913	-86.5804473
956	you be okay with end all abortion where there be no harm to the mother and child get it thank you for your prolife position I end it there I hear all the pro choice argument about the risk of give birth etc have a good one	mike_rippy	Notre Dame, IN	41.7001908	-86.23793280000001
957	euthanasia by organ donation for healthy people Prolife NoEuthanasia AssistedSuicide righttolife Euthanasia InvoluntaryPassiveEuthanasia PassiveEuthanasia	TheFabulousRee	Baton Rouge	30.4514677	-91.18714659999999
958	what about the right of these child you complain about child not be able to breathe with mask on I do think these child would agree with you on that if you be lay in bed die where be your right or do you only care about	HollyKeefer6	Wouldn't you like to know?	44.9811287	-93.16762829999999
960	he can protect a fetus that be ProLife	PatientDay	United States	37.09024	-95.712891
961	yes that be a bingo Vicky Prolife be only a tool of religious right to get christian vote because it appear to be a holy issue when in truth it be MEDDLING like a murderer thief evildoer Peter obsession with girl uterus be LUST amp IDOLATRY Exodus	RealYeshua1	TN USA Blue/Green Planet Earth	36.26160840000001	-86.5301145
962	we be the ProLife generation	itsrayperez	West Sac | Guam	38.5728066	-121.5750585
963	and to keep we safe from Covid your plan be to fight masking and vaccination at every turn I remember when ProLife mean you want people to live not just be bear	mrbongostx	Texas, USA	31.9685988	-99.9018131
964	we have select a difficult work of art to start get you comfortable with interpret artwork from a specific point of view have a crack at it there be no wrong answer art interpretation whatdoyousee prolife humandignity lovethemboth artmuseum prolivegen	mike_rippy	Notre Dame, IN	41.7001908	-86.23793280000001
965	yes ProDeath not Prolife CANNOT hear what they say because what they do scream ProDeath	RealYeshua1	TN USA Blue/Green Planet Earth	36.26160840000001	-86.5301145
966	part of charity be take people at their word and not make assumption about what their real motivation be G prolife	EqualRightsInst	Charlotte, NC	35.2270869	-80.8431267
967	one of the most common argument from the abortion industry be that a preborn child do not have the same value as a bear child because a preborn child be fully dependent on the mom but like most of their logic it just do make sense savethebabyhuman ProLife	HumanCoalition	Texas	31.9685988	-99.9018131
968	one of the most common argument from the abortion industry be that a preborn child do not have the same value as a bear child because a preborn child be fully dependent on the mom but like most of their logic it just do make sense savethebabyhuman ProLife	HuCoAction	United States	37.09024	-95.712891
969	Allyson Felix six time olympic gold medalist and two time world champion team with her primary sponsor Athleta to provide childcare grant to athlete at the Tokyo Olympics read about it here ProLife ChooseLife lovethemboth	OR_RTL	Salem, OR	44.9428975	-123.0350963
970	SIGN up today this week seminar serve as an exclusive unify force for MedicalStudents who care about hippocratic medicine Register here ProLife	aaplog	United States	37.09024	-95.712891
971	join we at am on the September at the Emmanuel Centre with special program for teen and tot great talk music and much more lifefromconceptionnoexception numberoneissue ProLife Whywemarch UK London	March4LifeUK	London, England	51.5073509	-0.1277583
972	Idk Pro life should encompass Gun Rights but I do seem to hear that argument much since that be the case I suggest GunRightsAreHumanRights be fundamental to secure the idea of ProLife	Zanzibar_Dallax	Ohio, USA	40.4172871	-82.90712300000001
973	look at the needle that say abort FETAL matter and this be why I be an AntiVaxxer ProLife	CorpNolga	Park Avenue	41.55621900000001	-93.6248305
974	this be why it important to respond to people not merely their statement via prolife	EqualRightsInst	Charlotte, NC	35.2270869	-80.8431267
975	LIFE FILM FEST in your home get your ticket now screening Aug use discount FORLIFE LIFEFESTFILMFESTIVAL ProLife SCCL SCLIFE	LIFEforSC	South Carolina	33.836081	-81.1637245
