Unnamed: 0	text	screen_name	location	LAT	LON
1135	be campaign on bankrupt Canada in month instead of month promise the only actual leader of any party be campaign on nolockdown prochoice vaccination novaccinemandate NoVaccinePassports VotePPC	SonnyBrakes	Algoma-Manitoulin-Kapuskasing	46.3844545	-82.6430503
1136	to be fair NoToole would have a difficult time find a prochoice MP within his party	blueskies366	Edmonton	53.5461245	-113.4938229
1138	accord to commentary if you protest Trudeau it simply anti mask and anti vax how about freedom and prochoice remember blackface	TraderMike16	Ontario, Canada	51.253775	-85.323214
1139	we be for freedom of choice we will never ask for proof of vaccine even if it be ever require in our industry novaccinepassportanywhere NoVaccinePassports NoVaccineMandates prochoice freedomofchoice	comeandstayltd	Stroud, England	51.745734	-2.217758
1140	so if it be my body my choice it be for woman too let they decide prochoice	grgnaz	Phoenix, AZ, USA	33.4483771	-112.0740373
1142	my body my Choice prochoice	F__cking_Master	CHAZ, Capitol Hill Seattle, WA	47.61526130000001	-122.3168598
1143	yup this what you really think Most of the lefty radical be also the dumb people at your university say in the video message to a group of Ryerson Young Conservatives cdnpoli and you not prochoice you lie	LizRiceToronto	Toronto, Canada	43.653226	-79.3831843
1144	we both follow each other on TikTok I feel so sad for she I wish I know any detox I can recommend she she one of the many people that be injure by the mrna jab novaccinepassport protectyourfamily prochoice	msfrancinetv	Rancho Cucamonga, CA	34.10639889999999	-117.5931084
1145	public face MitchMcConnell kind of reluctant to give governor advice about how they ought to carry out their responsibility during the pandemic privately do all he can to end votingright wreck the Supreme Court end legal abortion prochoice	Empath_Coach_RR	Books-Blog-Website-Workshops	37.9336054	-122.5168377
1146	who know antivaxxer be really prochoice	MasonRMcClellan	Minneapolis	44.977753	-93.2650108
1147	an important number of vaxxe people also end up in ICU so many important amp relevant info in country month ahead of we AU have a huge delay in this plandemic prochoice freedom	IdAustralian	Canberra, Australian Capital Territory	-35.2809368	149.1300092
1148	no termination of pregnancy involve in this scenario but it still have conservative Christians demand that society make woman comply with their agenda philosophy amp ideology these people always own themselves amp show their true nature always prochoice Antitheism	bazblackadder	Earth, Sol System, Alpha Quad	12.9994314	77.55277079999999
1149	this reek of when conservative shame woman that have abortion their body their choice prochoice	dfromthebx	South Bronx	40.8447819	-73.8648268
1150	or my favourite ppl who wo wear mask because my body my choice but try and have a say on what other should and should do with their body contradiction prochoice	HowdoesJay	Northern Ireland, United Kingd	54.7877149	-6.4923145
1151	do talk about it be about it you pro life you think woman should be force to carry unwanted pregnancy then open your door to one of those child and take on all the trauma and brokenness that come with it prochoice womensright	themrs_g_	Mount Dora, FL	28.8024918	-81.644519
1152	be a remarkable doctor and a fearless relentless champion of access to healthcare read this and show some support if you can abortionjustice prochoice medabortionirl abortionishealthcare reprohealth	MatHelman	Malden, MA	42.4250964	-71.066163
1153	so it be the standard mindset of Conservatives to view woman and people as be antonymous of each other their stance on abortion have nothing to do with sanctity of life but rather part of a more general broad sweeping hatred of woman prochoice christianity	bazblackadder	Earth, Sol System, Alpha Quad	12.9994314	77.55277079999999
1154	indeed prominent Republicans have class woman as host body and not people Oklahoma Justin Humphrey Florida GOP Jose Oliva Virginia GOP Steve Martin prochoice antichoice	bazblackadder	Earth, Sol System, Alpha Quad	12.9994314	77.55277079999999
1156	everyone be so overwhelmed with covid news still please go live amp do the shit you want your next minute be even promise donewithcovidtalk prochoice	LaiaRose_	Los Angeles, CA	34.0522342	-118.2436849
1157	it annoy I when people try to compare be prochoice with remain unvaccinated be not a fly penis impregnate man and woman you can pass it on to people who may die of it simply by have it possibly without even know GetVaccinated	JazzJohnson10	New York City	40.7127753	-74.0059728
1158	and mandate mask to protect child but do want to persecute woman prochoice	TumbyWallop	Philadelphia/Montana 	40.0429659	-75.073782
1159	I think you be prochoice	JamieGump	Chicago, IL	41.8781136	-87.6297982
1160	abuse prochoice sexualassault sa coverup adopt survivor trauma check out Transmomlesbianmoms video TikTok	ArtemisandDiana	USA	37.09024	-95.712891
1161	stop regulate woman womb get the out of woman right to choose womenshealth womensright prochoice	robertblraymond	st paul & forest lake, MN	45.2962838	-92.9754147
1162	rhetorical Question do you think the people who say they pray for guidance on how to cast their vote ever consider what the god they pray to think of they when they vote against their own family lgbtq prochoice VotingRights	michaelrohrer	New York City	40.7127753	-74.0059728
1163	I hope you keep work for the thing you support but also support President Biden excellent progress educate yourself about poverty woman right ProChoice and many other issue	jambie61	United States	37.09024	-95.712891
1164	termination of a pregnancy be between the pregnant person and their doctor only legal safe and private regardless of trimester abortionishealthcare prochoice	pixposies	Old California	33.803736	-117.8646946
1165	Jeff position actually have nothing to do with sanctity of life as evidence by this tweet where he demonstrate that he do even think his own mother have personhood say it all antichoice prochoice antitheism	bazblackadder	Earth, Sol System, Alpha Quad	12.9994314	77.55277079999999
1167	cheater scandal prochoice knowledge be power site sexual Revolution be bring sexodus G	WomensPowerBook	UK	55.378051	-3.435973
1168	what about week or week prochoice	CthaReth	London 	51.5073509	-0.1277583
1169	no mother regardless of her situation should be deny a right to safe and accessible abortion prochoice	Cameron77538598	Queensland, Australia	-22.575197	144.0847926
1170	imagine if Osama Bin Laden be abort prochoice	Cameron77538598	Queensland, Australia	-22.575197	144.0847926
1171	the world be overpopulated prochoice	Cameron77538598	Queensland, Australia	-22.575197	144.0847926
1172	do I need your permission to post Rock too cause the first time I lie to my parent it be to see Ozzy on the first Rock in Rio with a surfer boyfriend Shocker I could be your mother Montgomery prochoice respect staysafe	AnaBvlaqua	California, USA	36.778261	-119.4179324
1173	we support you mate istandwithtruckie prochoice freedom	IdAustralian	Canberra, Australian Capital Territory	-35.2809368	149.1300092
1174	Texas have become no on my list of state I never step foot in nor spend a dime on any company that be base there Ladies time to unite yet again and make our voice hear our body our self WomensEqualityDay prochoice	Miyahoka	Colorado	39.5500507	-105.7820674
1175	I keep heat anti vax people say my body my choice what your view on abortion my body my choice right antivaxxer prochoice	therealhoff74	Melbourne, Victoria	-37.8136276	144.9630576
1176	and it should not include kid what be wrong with you we be mean to protect the kid not poison they prochoice	mrnudie	Ellenborough, NSW, Australia	-31.433333	152.466667
1177	I both white amp old amp I advocate for CancelStudentDebt VoterRights amp BLM amp ProChoice WomensRights Democracy amp equality need an America that humane kind amp empathic to other	love2laugh4ever	Wardsboro, VT 05355	43.0227482	-72.79246119999999
1178	put people include family with actual child in a position where their ability to put food on the table keep the light on and a roof over their head be in jeopardy lady and gentleman the most pro life scotus ever scotus prochoice	bazblackadder	Earth, Sol System, Alpha Quad	12.9994314	77.55277079999999
1179	yeah that would never prochoice	samuel_muha	Overland Park, KS	38.9822282	-94.6707917
1180	check out new riff second of metal heaven by aixtc naturephotography animalright climatechange resist gamer dbd Xbox PRU impeachkavanaugh neverthelessshepersiste votebluenomatterwho DemcastNC Resistance ProChoice	vjtight	SYDNEY	-33.8688197	151.2092955
1181	the walk Dead Prochoice God give scientist amp researcher the tool to make a vaccination yet you refuse makeitmakesense DeltaVariant antivaxxer willful ignorance will cost you your life or your child live protect the child under	MsNadiaWithLove	Chicago	41.8781136	-87.6297982
1183	who know the Leftists Democrats and Liberals would come out against we be prochoice Ya know mybodymychoice if you do want the vax suddenly you have GretaThornberg in your ear how dare you	writingkat63	San Antonio TX	29.4241219	-98.49362819999999
1184	your white fragility willful ignorance white privilege amp fake superiority entitlement complex will have you cling for life on a ventilator or dead your choice prochoice maskup VaxUp or die try not to	MsNadiaWithLove	Chicago	41.8781136	-87.6297982
1186	your body your choice prochoice	dfromthebx	South Bronx	40.8447819	-73.8648268
1187	I be stand by woman to not have the gov interfere with their choice for their body I be prochoice bc I believe it be a personal not gov issue now be my moment I need support to not have the gov demand a vaccine be inject into my body will you stand with I	Kevins_views	We All Deserve Better, FL	27.6648274	-81.5157535
1191	ah yes two man agree that woman have enough despite woman disagree cdnpoli prochoice	cdnpoli_memes	Toronto, Ontario	43.653226	-79.3831843
1192	Catherine you tell people what to do be no well than people scream profanity and yell at politician weallliveinglasshouse and therefore should mindourownbusiness and forget the VainRepetition changeneede ProChoice	GTamburrino	St City, AB, Canada	53.633117	-113.6281051
1193	it be well worth note that antichoicer have slip up amp openly admit their real grievance with Planned Parenthood be that it allow people to have sex for pleasure rather than solely for procreation prochoice antichoice ChristianSharia	bazblackadder	Earth, Sol System, Alpha Quad	12.9994314	77.55277079999999
1194	it be a divide and conquer tactic and the world be fall for it stopthelie prochoice	KingMANDOge	Washington, USA	47.7510741	-120.7401385
1195	note for the day right wing evangelical and the be the enemy of democracy as for you you be still on the the hook pass johnlewisvotingrightsact and the forthepeopleact now to protect voting right also protect woman right to choose prochoice	AndrewJRix	Humboldt County, CA	40.7450055	-123.8695086
1196	oh and I forget prochoice	Lynn6Laci	Texas, USA	31.9685988	-99.9018131
1197	nobody need restaurant gym and other place they need we start stand your ground and stop give up your freedom prochoice	yzowl	EVERYWHERE	41.889509	-87.65605099999999
1198	I be so ashamed of this riding trust I Eric there be decent progressive who live here nevervoteconservative climatechangeisreal VaccinesWork ProChoice	fionaross15	ON, Canada	51.253775	-85.323214
1199	it be real healthcare just because it be woman who avail of it do mean that be the case and no baby be involve in abortion they be merely non viable non sentient foetus or even early form of gestation calm down with the hysteria and hyperbole prochoice	bazblackadder	Earth, Sol System, Alpha Quad	12.9994314	77.55277079999999
1200	this be a great prochoice argument thank you	JimmyFitzner	Indian Mound Northeast KC	39.116435	-94.5186165
1202	Pro Science be the understanding that the science be always shift why be this lose on so many people proscience unmaskthekid prochoice	maggmski88	buffalo ny	42.88644679999999	-78.8783689
1203	operation Save America the group involve here state that it be satanic for woman to participate in the workforce it have never really be about the sanctity of life it be opposition to woman right as a whole prochoice ChristianTaliban	bazblackadder	Earth, Sol System, Alpha Quad	12.9994314	77.55277079999999
1205	thank you to Maeve Taylor and for point out that the access to free safe and legal abortion be a fundamental part of woman health care that simple perspective will bring we much close to reproductive autonomy prochoice	RonjaSchicke	Berlin	52.52000659999999	13.404954
1207	vaccinated or Unvaccinated spread love not hate ProChoice	shaishai64	Aiea, HI	21.386338	-157.9255357
1208	we appreciate you prochoice antimandate auspol k	nhimbus13	Brisbane, Queensland	-27.4704528	153.0260341
1209	prochoice include the uterus too	LaurelL47630025	Texas, USA	31.9685988	-99.9018131
1210	this be Absolute Bullshit no one have the right to force a medical procedure upon another MedicalApartheid prochoice SydneyLockdown covidnsw scamdemic	DVirumEtMachina	Sydney, Australia	-33.8688197	151.2092955
1211	if the jab work you be cover if the jab do work what be its function exactly this racket be for the stupid prochoice	Hypatia70	Alexandria 	38.8048355	-77.0469214
1212	handmaidstale womensright prochoice TexasStupid votethemout Texas let do this	SilverQueen7	Spring	30.0799405	-95.41716009999999
1213	VACCINATION cards here the thing nobody need restaurant gym and other place they need we start stand your ground and stop give up your	yzowl	EVERYWHERE	41.889509	-87.65605099999999
1214	so now the antivaxxer and antimasker be scream mybodymychoice but they only prochoice when it right to their life	huntgbj	Ohio	40.4172871	-82.90712300000001
1215	so now the right be ProChoice because the nurse do want vaccine	thebunzilla	Unknown	35.2207201	-80.8577983
1216	lol abortion access post immediate follower loss prochoice AbortoLegal	ReanaMK	Piscataway lands (DC)	38.6873401	-77.0498981
1217	drop your comment for consider it a fun townhall TikTok twitter abbottfailedtexasagain covid prochoice heartbeatbill TikTok	TexasLife7	Texas, USA	31.9685988	-99.9018131
1218	back that up prochoice people die of anything stroke pneumonia obesity hepatitis etc it all scary but not nearly as scary as penalize people for choose their own path	stauvin	Grand Rapids, MI	42.9633599	-85.6680863
1219	my body my choice my uterus be in my body so yay for freedom and be prochoice	LaurelL47630025	Texas, USA	31.9685988	-99.9018131
1220	my body my choice my uterus be my body so I also get to do whatever I want to it my body yay for be prochoice	LaurelL47630025	Texas, USA	31.9685988	-99.9018131
1221	yes my body by choice include my uterus which be in my body prochoice	LaurelL47630025	Texas, USA	31.9685988	-99.9018131
1222	yes my body my choice my uterus be in my body also my choice yay for prochoice	LaurelL47630025	Texas, USA	31.9685988	-99.9018131
1223	my body my choice my uterus my choice prochoice always	LaurelL47630025	Texas, USA	31.9685988	-99.9018131
1224	mybodymychoice prochoice myuterusmychoice stay out of my body my uterus be my choice yay	LaurelL47630025	Texas, USA	31.9685988	-99.9018131
1225	ProChoice be ya	livelifel1	Utah	39.3209801	-111.0937311
1226	we do prochoice	Jeff416Vella	yyz	43.67771760000001	-79.6248197
1227	Pop Quiz Hot Shot be you prochoice	JaxTruther	Jacksonville FL.	30.3321838	-81.65565099999999
1228	I be out all over with work see friend and family all the time out to restaurant and bar travel lot no vaccine for I very important to maintain one personal health ProChoice	Mi_Astronauta	USA	37.09024	-95.712891
1229	the right to sovereignty over own body be what prochoice on abortion be all about I wonder what his stance be on that	RomneyTM	California, USA	36.778261	-119.4179324
1231	I guess prochoice mean something different now Canada vaccination	cockrates1	Moncton, New Brunswick	46.0878165	-64.7782313
1232	ProChoice be never anti life ban on abortion be dangerous and harmful add your name to say no ban not now not ever	damnitdisney	Long Beach, CA	33.7700504	-118.1937395
1233	not really the reality the FL supreme court will overrule this and mask will be optional as usual anyone any age be free to wear mask in any state but that be their personal choice to make prochoice	Mi_Astronauta	USA	37.09024	-95.712891
1234	Misogyny and prolife go hand in hand prochoice	unionwoman226	Crescent Park BC	49.050112	-122.8572083
1235	that be be my experience lie lie lie be what the anti choicer do good prochoice	unionwoman226	Crescent Park BC	49.050112	-122.8572083
1238	thank you antivaxxer for understanding and support prochoice when it come to health right	0joehand	Seattle 🌎	47.6062095	-122.3320708
1239	so what everybody spamme the Texas abortion whistleblower site with prochoice	supercooltimes	Mississippi, MS	32.3546679	-89.3985283
1240	I will start by say IM vaccinate and I do nt get ppl who do but no ONE should be force to do anything to their body prochoice	islipjetsfan	LONG ISLAND	40.789142	-73.13496099999999
1241	it be a personal choice if we be go to stand by prochoice mybodymychoice we ca candy pick how we get to choose I make the personal choice to get it and that be mychoice	lolo_coco	Milwaukee	43.0389025	-87.9064736
1242	outrage by TX legislature I just make a donation to you should too prochoice	mkepvdnycphl	Philadelphia, PA, USA	39.9525839	-75.1652215
1243	oh look be suddenly ProChoice	Plasstastic	Idaho, USA	44.0682019	-114.7420408
1244	Yep no one have the authority to mandate or not this decision be make at the individual level imagine someone say you need to have an abortion or no you ca have one prochoice	Tyler13rowne	San Francisco 	37.7749295	-122.4194155
1246	it sure would be wild if everyone click this link and spamme the website with complete bullshit they can never wade through in order to protect the handful of people that will be target by that site prochoice fucktexas	BearProletarian	Durham, NC	35.9940329	-78.898619
1248	it be one thing to have an opinion another to refuse someone to have agency over themselves read that again prochoice	arayhareem	Karachi, Pakistan	24.8607343	67.0011364
1249	truth anyone who make a choice be prochoice	beshannonphotos	Northern Virginia	38.8674583	-77.2337951
1250	you know who you be transrightsarehumanright rainbowbrigade AlphabetMafia prochoice WomensEqualityDay AdoptDontShop dontdeclaw	RebelOtakuchan	Oklahoma	35.0077519	-97.092877
1251	my bar get you high theirs make u wish you be dirtysouthchronicle prolificartist prochoice LGBTQIA writer	Megaciph	Mobile, AL	30.6953657	-88.0398912
1252	fine prochoice	kay4k_	teyvat | 16 | asexual | enfj	36.1602597	-95.99800979999999
1253	the shame be also on thedemocrat who have be claim to be prochoice for at least the last year but still have not codify roe woman would nt be subject to the whim of scotus if would stop blackmail voter over roevwade and codifyroe	nvrqt	banana republic of america	44.853879	-93.243831
1254	it be great there be some people out in the country try to advocate for woman and abortion but why have the dem as a whole not codify roe federally they talk a good game about be prochoice but then leave individual to fight the fight at scotus codifyroe	nvrqt	banana republic of america	44.853879	-93.243831
1255	hate to agree with cop and think police union should be abolish but they re right on this covid vaccine mandate idiocracy freedom prochoice oneverythe	nvrqt	banana republic of america	44.853879	-93.243831
1256	justice breyer should retire geriatric assistedlive usg expandthecourt retirebreyer impeachkavanaugh but dem wo nt do shit because they like hang scotus over the head of prochoice voter codifyroe endthevoterblackmail	nvrqt	banana republic of america	44.853879	-93.243831
1259	perfect every since I start to follow unlike minded algorithm take a right turn or should I say leave turn on and I can keep my mind open but also not get shadow ban the algorithm do know what to make of I vaxx prochoice liberal conservative	Bootsonthegro10	Saskatoon, Saskatchewan	52.157902	-106.6701577
1260	in the mood for some righteous trolling this anti choice website call on citizen to hold abortionist accountable by anonymously report provider or other who aid and abet an abortion in Texas after week prochoice	EmilyLindin	United States	37.09024	-95.712891
1261	cool like his view on that Personal Choice prochoice	Mi_Astronauta	USA	37.09024	-95.712891
1263	do lose focus HumanRights lgbtq WomensHealth prochoice MeToo blacklivesmatter MMIWG votebluenomatterwho NoHate universalhealthcare JusticeReform CommonSenseGunlaws youmatter mentalhealthmatter	ResistsAli	United States	37.09024	-95.712891
1264	just an ER nurse share the thing that I see prochoice	McLewis17	Charlotte, NC	35.2270869	-80.8431267
1265	by their logic the reverse should also be true Funny though we do hear ProChoice demand this	1SydNee1	Sydney, Australia	-33.8688197	151.2092955
1266	Republicans at every level want basic like healthcare voting and anti terrorism to all be partisan issue that be fine if they do want to represent the voter and would rather represent terrorist domestic and foreign then so be it prochoice GOPHypocrisy	MoffatDems	Colorado, USA	39.5500507	-105.7820674
1267	their body their choice same as it always be prochoice	dfromthebx	South Bronx	40.8447819	-73.8648268
1268	fascist come in all kind of package these day ProChoice	Bjorn2BAlive	Earth	37.2321077	-95.7243335
1269	you can now report people for abortion thank to this new law I be need the kpop army spam to get on this quick btsarmy btsxbillboard KPOP prochoice fuckabbott	Randa8908	Georgetown, TX	30.6332618	-97.6779842
1270	sorry I do know if you hear but conservative be ProChoice now	MoparGirl71	Las Vegas, NV	36.1699412	-115.1398296
1271	our prochoice mean rcrc promote the constitutional right of all people to make their own reproductive health decision without shame and stigma rcrc challenge system of oppression that impede individual from access comprehensive reproductive care rcrchoice	RCRChoice	Washington, DC	38.9071923	-77.0368707
1272	poll show half of oppose a shot mandate I see what you do there prochoice	dandreprosise	Indigenous Land 	44.4708256	-78.3662228
1273	sure would be bad if people be to say spam the shit out of this page prochoice	Aly_Dar8	Washington, D.C.	38.9071923	-77.0368707
1274	prochoice forever	ihusisian	Clarks Summit, PA	41.4886892	-75.70852479999999
1275	what the fuck be wrong with liberal test virus free or be vaccinate Virus free be all that should be require do some self reflection there be people who ca take vaccine due to medical issue or age tho why they opt out be anyone business ever ProChoice	love2laugh4ever	Wardsboro, VT 05355	43.0227482	-72.79246119999999
1276	stand United resisttyranny prochoice FactsMatter mybodymychoice FactsNotFear standunited godblessamerica	voipster537	Denver, CO	39.7392358	-104.990251
1277	tonight you can still RSVP for our House Party join guest speaker Cowett amp our amazing co host include more and other prochoice friend purchase ticket today	PersonalPAC	Chicago, IL	41.8781136	-87.6297982
1279	Lisa Shaws autopsy that have confirm a covid vaccine induce death be precisely the reason why vaccine should never be mandatory it be simply unethical no matter how rare or unlucky a death be LisaShaw NoMandatoryVaccines prochoice	Ella_621	Ipswich, England	52.056736	1.14822
1280	The Twitter verification system provide the site reader with a means to distinguish genuine notable account holder such as celebrity and organization stop hide behind your blue check mark NoVaccinePassports prochoice leaveourkidsalone	francisbroz	West Sussex England	50.9280143	-0.4617075
1282	there be register sex offender in canada the reason they do nt have the same ID system for they be because it violate their privacy it be nobody business what anybody medical history be that be the law whether you like it or not prochoice	goldismoney22	Vancouver, British Columbia	49.2827291	-123.1207375
1283	he be a prime example of why law enforcement official should be elect but I be glad be prochoice now	tmasseyaz	San Tan Valley, AZ	33.177294	-111.5468301
1285	the apparently be ProChoice	GreatStoneFace	Fairfax County, VA	38.9085472	-77.2405153
1286	ProChoice activism come in all shape and size and colour	Rebels4Choice	Cork, Ireland	51.8985143	-8.4756035
1287	if this be enough for you to get vaccinate cool if this be enough for you to be do with Austin City Limits forever cool prochoice	JohnatanFuerte	Dallas, TX	32.7766642	-96.79698789999999
1288	otooleTheFool be too connected to harper he have lie that he be prochoice and support many deplorable republican policy I do know what OToole think about t but I know that Harper be a fan	sdcinvancouver	Vancouver	49.2827291	-123.1207375
1289	Dr Leah Torres risk everything to provide safe abortion to woman in Alabama it cost she k and lose her medical license now she need our help if you believe woman have the right to health care maybe chip in a few dollar I do prochoice	wendyweb47	Canada	56.130366	-106.346771
1290	oh dear oh much do you care about all these baby u speak of after they be bear what do you do for all the kid sugfere in the world Bc it sound to I there be a lot of care about the pregnancy of other but not so much about kid well being in general prochoice	ZeldaMichelle_	Sweden 	60.12816100000001	18.643501
1293	pro choice I want you to have the choice for an abortion and I want you to have the choice to get vaccinate you ca pick and choose what people can and ca do with their own body while claim to be prochoice	stephenwright21	Austin, Texas.	30.267153	-97.7430608
